{
  "schemaVersion": 1,
  "manifestType": "world-builder-current-platform-release",
  "strategyId": "current-managed-runtime-v1",
  "platformReleaseId": "current-platform-v2",
  "platformApiVersion": "current-platform-api-v1",
  "protocolId": "current-protocol-v1",
  "stateSchemaId": "current-state-v2",
  "supportedPredecessorReleaseIds": ["current-platform-v1"],
  "variants": ["current-advanced-v1", "current-base-v1"],
  "inputAdapters": ["preservation-synthetic-v1"],
  "platformManifestHash": "0f5de4f947b5864ced91ef3865daa318c952070362044acb05a7a938830ebe4c"
}
